{
  "schema_version": 1,
  "icon_id": "printer-feeding-document",
  "family": "solo",
  "name": "Printer feeding document",
  "description": "",
  "tags": [
    "printer",
    "document",
    "paper",
    "printing",
    "machine",
    "office"
  ],
  "aliases": [],
  "category": "objects/office",
  "keywords": [
    "printer",
    "document",
    "paper",
    "printing",
    "machine",
    "office"
  ]
}
