{
  "schema_version": 1,
  "icon_id": "google-digital-garage-logo",
  "family": "solo",
  "name": "Google digital garage logo",
  "description": "",
  "tags": [
    "google-digital-garage",
    "google",
    "learning",
    "logo",
    "brand",
    "training",
    "stack"
  ],
  "aliases": [],
  "category": "logos",
  "keywords": [
    "google-digital-garage",
    "google",
    "learning",
    "logo",
    "brand",
    "training",
    "stack"
  ]
}
