{
  "schema_version": 1,
  "icon_id": "car",
  "family": "solo",
  "name": "Car",
  "description": "",
  "tags": [
    "solo-ai-cars-refine",
    "solo-ai-next100",
    "car"
  ],
  "aliases": [],
  "category": "transportation",
  "keywords": [
    "solo-ai-cars-refine",
    "solo-ai-next100",
    "car"
  ]
}
