{
  "schema_version": 1,
  "icon_id": "two-bar-battery",
  "family": "solo",
  "name": "Two bar battery",
  "description": "",
  "tags": [
    "battery",
    "two-bars",
    "charge",
    "power",
    "energy",
    "level",
    "indicator"
  ],
  "aliases": [],
  "category": "objects/mobile",
  "keywords": [
    "battery",
    "two-bars",
    "charge",
    "power",
    "energy",
    "level",
    "indicator"
  ]
}
