{
  "schema_version": 1,
  "icon_id": "clock-sub",
  "family": "sub",
  "name": "Clock sub",
  "description": "",
  "tags": [
    "clock",
    "round",
    "face",
    "contains",
    "hands",
    "meeting",
    "centrally",
    "pointing"
  ],
  "aliases": [],
  "category": "primitives/mark",
  "keywords": [
    "clock",
    "round",
    "face",
    "contains",
    "hands",
    "meeting",
    "centrally",
    "pointing"
  ]
}
