{
  "schema_version": 1,
  "icon_id": "damaged-shipping-box",
  "family": "solo",
  "name": "Damaged shipping box",
  "description": "",
  "tags": [
    "box",
    "parcel",
    "damage",
    "tear",
    "shipping",
    "package"
  ],
  "aliases": [],
  "category": "objects/shipping",
  "keywords": [
    "box",
    "parcel",
    "damage",
    "tear",
    "shipping",
    "package"
  ]
}
