{
  "schema_version": 1,
  "icon_id": "person-walking-down-slope",
  "family": "solo",
  "name": "Person walking down slope",
  "description": "",
  "tags": [
    "person",
    "walking",
    "slope",
    "downhill",
    "descent",
    "pedestrian"
  ],
  "aliases": [],
  "category": "objects/wayfinding",
  "keywords": [
    "person",
    "walking",
    "slope",
    "downhill",
    "descent",
    "pedestrian"
  ]
}
