{
  "schema_version": 1,
  "icon_id": "wild-bird",
  "family": "solo",
  "name": "Wild bird",
  "description": "",
  "tags": [
    "bird",
    "songbird",
    "standing",
    "wing",
    "beak",
    "wildlife",
    "garden",
    "perch"
  ],
  "aliases": [],
  "category": "nature/animals",
  "keywords": [
    "bird",
    "songbird",
    "standing",
    "wing",
    "beak",
    "wildlife",
    "garden",
    "perch"
  ]
}
