{"schema_version":1,"icon_id":"seated-person-beside-front-facing-car","family":"solo","name":"Seated person beside front facing car","description":"","tags":["seated","person","beside","front","facing","car"],"aliases":[],"category":"objects","keywords":["seated","person","beside","front","facing","car"]}
