{
  "schema_version": 1,
  "icon_id": "zoom-in-magnifying-glass-with-plus-badge",
  "family": "container",
  "name": "Zoom in magnifying glass with plus badge",
  "description": "",
  "tags": [
    "zoom",
    "magnify",
    "enlarge",
    "search",
    "lens",
    "plus"
  ],
  "aliases": [
    "magnifying-glass-with-plus-badge"
  ],
  "category": "containers",
  "keywords": [
    "zoom",
    "magnify",
    "enlarge",
    "search",
    "lens",
    "plus"
  ]
}
