{"schema_version":1,"icon_id":"bowler-approaching-a-pin","family":"solo","name":"Bowler approaching a pin","description":"","tags":["bowler","bowling","ball","pin","sport","person","game"],"aliases":[],"category":"objects/reference","keywords":["bowler","bowling","ball","pin","sport","person","game"]}
