{"schema_version":1,"icon_id":"compact-disc-with-reflection-bands","family":"solo","name":"Compact disc with reflection bands","description":"","tags":["cd","compact-disc","disc","music","playing","media","audio","album"],"aliases":[],"category":"objects/music","keywords":["cd","compact-disc","disc","music","playing","media","audio","album"]}
