{
  "schema_version": 1,
  "icon_id": "split-horizontal-large-head",
  "family": "solo",
  "name": "Split horizontal large head",
  "description": "",
  "tags": [
    "split",
    "horizontal",
    "large",
    "head",
    "arrows"
  ],
  "aliases": [],
  "category": "arrows",
  "keywords": [
    "split",
    "horizontal",
    "large",
    "head",
    "arrows"
  ]
}
