{
  "schema_version": 1,
  "icon_id": "delivery-truck-with-export-arrow-solo-b005-08",
  "family": "solo",
  "name": "Delivery truck with export arrow solo b005 08",
  "description": "",
  "tags": [
    "delivery",
    "truck",
    "with",
    "export",
    "arrow"
  ],
  "aliases": [],
  "category": "objects",
  "keywords": [
    "delivery",
    "truck",
    "with",
    "export",
    "arrow"
  ]
}
