{"schema_version":1,"icon_id":"vertical-two-finger-scroll-gesture","family":"solo","name":"Vertical two finger scroll gesture","description":"","tags":["fingers","up","down","arrows"],"aliases":["two-finger scroll","vertical scroll gesture"],"category":"gestures/touch","keywords":["fingers","up","down","arrows"]}
